{
  "$schema": "https://json-schema.org/draft/2020-12/schema",
  "$id": "https://mental-wellness-platform/contracts/research-export/export-manifest/v1.0.0",
  "title": "ResearchExportManifest",
  "description": "Manifest of one research export batch from the application to Workstream B (ADR-010). The batch is a JSONL file of feature records (contracts/voice-features/feature-record.schema.json v2.0.0) whose IDs have been re-keyed with an application-held HMAC key, timestamps truncated to the date and free text removed. Workstream B must verify the file hash, validate every record, apply withdrawn_record_ids before using any data, and never use model_training_excluded records for training. Contains no direct identifiers and no application IDs.",
  "version": "1.0.0",
  "type": "object",
  "required": ["manifest_version", "export_id", "created_at_utc", "feature_schema_version", "records_file", "record_count",
               "rekey", "split_groups", "model_training_excluded", "withdrawn_record_ids", "exclusions"],
  "additionalProperties": false,
  "properties": {
    "manifest_version": { "type": "string", "const": "1.0.0" },
    "export_id": { "type": "string", "pattern": "^exp_[a-f0-9]{32}$" },
    "created_at_utc": { "type": "string", "format": "date-time" },
    "feature_schema_version": { "type": "string", "const": "2.0.0" },
    "records_file": {
      "type": "object",
      "required": ["name", "sha256", "bytes"],
      "additionalProperties": false,
      "properties": {
        "name": { "type": "string", "pattern": "^exp_[a-f0-9]{32}\\.jsonl$" },
        "sha256": { "type": "string", "pattern": "^[a-f0-9]{64}$" },
        "bytes": { "type": "integer", "minimum": 0 }
      }
    },
    "record_count": { "type": "integer", "minimum": 0 },
    "rekey": {
      "type": "object",
      "description": "How IDs were re-keyed. The key itself never leaves the application.",
      "required": ["method", "key_id"],
      "additionalProperties": false,
      "properties": {
        "method": { "type": "string", "const": "HMAC-SHA256-TRUNC128-V1" },
        "key_id": { "type": "string", "pattern": "^key_[a-f0-9]{16}$", "description": "Fingerprint identifying the key (not the key)." }
      }
    },
    "split_groups": {
      "type": "object",
      "description": "Re-keyed session_id -> split group. Sessions of the same participant share a group, so Workstream B can make participant-level splits (model-validation-plan.md section 4) without receiving any participant reference.",
      "propertyNames": { "pattern": "^sess_[a-f0-9]{32}$" },
      "additionalProperties": { "type": "string", "pattern": "^grp_[a-f0-9]{32}$" }
    },
    "model_training_excluded": {
      "type": "array",
      "description": "Re-keyed record_ids in this file whose participant did not grant MODEL_TRAINING (or withdrew it). They may be used for research analysis but never for training.",
      "items": { "type": "string", "pattern": "^frec_[a-f0-9]{32}$" },
      "uniqueItems": true
    },
    "withdrawn_record_ids": {
      "type": "array",
      "description": "Re-keyed record_ids exported earlier whose consent has since been withdrawn. Workstream B must remove them before the next dataset build (consent-and-data-lifecycle.md section 4).",
      "items": { "type": "string", "pattern": "^frec_[a-f0-9]{32}$" },
      "uniqueItems": true
    },
    "exclusions": {
      "type": "object",
      "description": "Counts only (never IDs) of records not exported, by reason.",
      "required": ["no_research_consent", "audio_consent_withdrawn"],
      "additionalProperties": false,
      "properties": {
        "no_research_consent": { "type": "integer", "minimum": 0 },
        "audio_consent_withdrawn": { "type": "integer", "minimum": 0 }
      }
    }
  },
  "x-changelog": [
    { "version": "1.0.0", "date": "2026-10-18", "changes": "Initial manifest (slice S8)." }
  ],
  "x-governance": {
    "direct_identifiers_prohibited": true,
    "application_ids_prohibited": true,
    "consent_filtered_at_export_time": true,
    "note": "Built only on explicit human request (CLAUDE.md rule 5). The HMAC key stays in the application environment."
  }
}
